id,user_posted,name,description,date_posted,photos,url,quoted_post,tagged_users,replies,reposts,likes,views,external_url,hashtags,followers,biography,posts_count,profile_image_link,following,is_verified,quotes,bookmarks,parent_post_details,external_image_urls,videos,external_video_urls,verification_type,user_id,context_added,timestamp,input,error,error_code,warning,warning_code
1781148811697484023,historyoarmani2,Armani,israel and it’s western allies have shown the rest of the world that they are committed to start a global war instead of ending a genocide. These aren’t rational people. These aren’t diplomatic nations. israel and it’s allies are terrorists holding the world hostage!,2024-04-19T02:32:23.000Z,,https://x.com/historyoarmani2/status/1781148811697484023,"{""post_id"":null,""profile_id"":null,""profile_name"":null,""data_posted"":null,""url"":null,""description"":null,""photos"":null,""videos"":null}",,9,144,374,20844,,,7046,,9840,https://pbs.twimg.com/profile_images/1654538179314176000/HNTHywOu_normal.jpg,936,FALSE,2,13,"{""post_id"":null,""profile_id"":""1312162630350536704"",""profile_name"":""Armani""}",,,,,1312162630350536704,,2025-07-24T01:48:43.640Z,"{""url"":""https://x.com/historyoarmani2/status/1781148811697484023""}",,,,
1946266821516231006,karulf_grimfang,Karulf Grimfang,"@ArchRose90 None!These women-beating and bloodthirsty savages love to play victim and continue their goal to assimilate, and Dominance.  The world needs to declare WAR against these murderous radicals and those who are involved in the diabolical 2030 agenda.",2025-07-18T17:52:24.000Z,,https://x.com/karulf_grimfang/status/1946266821516231006,"{""post_id"":null,""profile_id"":null,""profile_name"":null,""data_posted"":null,""url"":null,""description"":null,""photos"":null,""videos"":null}","[{""profile_id"":""1647291168"",""profile_name"":""Chris Rose"",""url"":""https://x.com/ArchRose90"",""biography"":null,""is_verified"":null,""following"":null,""followers"":null}]",0,4,32,775,,,1885,🇨🇦 Streamer / ADHD / Western Nord / Hobbyist / Wolf Astartes - W40k Fan / Pro-Humanity / Truthseeker,30723,https://pbs.twimg.com/profile_images/1894994060017864704/ktLmoyKm_normal.jpg,606,FALSE,0,0,"{""post_id"":""1946249307444617552"",""profile_id"":""1647291168"",""profile_name"":""ArchRose90""}",,,,blue,1647291168,,2025-07-24T01:48:43.647Z,"{""url"":""https://x.com/karulf_grimfang/status/1946266821516231006""}",,,,
1948176946044481898,JThates,J.T,@1488forever_ @bagginsbags @TheKing92483270 @suhnudyeus @TonyMichaelX He specifically says we’re all equal. You’re retarded for believing in this Jewish nonsense and bending over backwards in public to defend it with 1488 in your name. You’re an embarrassment to the White race frankly. You need to start respecting yourself.,2025-07-24T00:22:33.000Z,,https://x.com/JThates/status/1948176946044481898,"{""post_id"":null,""profile_id"":null,""profile_name"":null,""data_posted"":null,""url"":null,""description"":null,""photos"":null,""videos"":null}","[{""profile_id"":""1939734107526676480"",""profile_name"":""1488forever"",""url"":""https://x.com/1488forever_"",""biography"":null,""is_verified"":null,""following"":null,""followers"":null},{""profile_id"":""1813964926211551233"",""profile_name"":""Haunted Humor"",""url"":""https://x.com/bagginsbags"",""biography"":null,""is_verified"":null,""following"":null,""followers"":null},{""profile_id"":""1787524773968289793"",""profile_name"":""The King"",""url"":""https://x.com/TheKing92483270"",""biography"":null,""is_verified"":null,""following"":null,""followers"":null},{""profile_id"":""1934798941100625924"",""profile_name"":""Suhnú Dyēus 𖥞"",""url"":""https://x.com/suhnudyeus"",""biography"":null,""is_verified"":null,""following"":null,""followers"":null},{""profile_id"":""1520192012665958400"",""profile_name"":""TONY"",""url"":""https://x.com/TonyMichaelX"",""biography"":null,""is_verified"":null,""following"":null,""followers"":null}]",1,0,0,29,,,393,Svenstreams,9624,https://pbs.twimg.com/profile_images/1850307063869583361/g9vZutEe_normal.jpg,357,FALSE,0,0,"{""post_id"":""1948176137399468112"",""profile_id"":""1939734107526676480"",""profile_name"":""1488forever_""}",,,,blue,1939734107526676480,,2025-07-24T01:48:43.663Z,"{""url"":""https://x.com/JThates/status/1948176946044481898""}",,,,
1947395762234814552,JMcjewface,Soapywaffen Lampshades,"@TheGoyimWaffen I’m trying to get this message across to people all the time.  Just because I’m antisemitic doesn’t mean I’m pro-muslim, quite the opposite actually.  But the whole reason they are overrunning White countries is because of jew influence and advocacy groups like HIAS",2025-07-21T20:38:25.000Z,,https://x.com/JMcjewface/status/1947395762234814552,"{""post_id"":null,""profile_id"":null,""profile_name"":null,""data_posted"":null,""url"":null,""description"":null,""photos"":null,""videos"":null}","[{""profile_id"":""1931327187992383488"",""profile_name"":""𝐀𝐍𝐒"",""url"":""https://x.com/TheGoyimWaffen"",""biography"":null,""is_verified"":null,""following"":null,""followers"":null}]",0,0,4,25,,,447,Construction expert specializing in the building of towers.  Proud member of the Local 1488.,520,https://pbs.twimg.com/profile_images/1942790312058855424/est4w4xb_normal.jpg,343,FALSE,0,0,"{""post_id"":""1947362684355100874"",""profile_id"":""1931327187992383488"",""profile_name"":""TheGoyimWaffen""}",,,,,1931327187992383488,,2025-07-24T01:48:43.683Z,"{""url"":""https://x.com/JMcjewface/status/1947395762234814552""}",,,,
1800972403138494519,AncestralVril,Ancestral Vril,@Klaus_Arminius 4800 Jewish bioweapons ready to destroy Ireland.,2024-06-12T19:24:16.000Z,,https://x.com/AncestralVril/status/1800972403138494519,"{""post_id"":null,""profile_id"":null,""profile_name"":null,""data_posted"":null,""url"":null,""description"":null,""photos"":null,""videos"":null}","[{""profile_id"":""1483893386817986574"",""profile_name"":""Klaus Arminius"",""url"":""https://x.com/Klaus_Arminius"",""biography"":null,""is_verified"":null,""following"":null,""followers"":null}]",10,9,289,6677,,,57315,Christian nationalist. I write about culture wars.,5551,https://pbs.twimg.com/profile_images/1618911365111898119/OmVRKgkB_normal.jpg,352,FALSE,1,2,"{""post_id"":""1800943724874059881"",""profile_id"":""1483893386817986574"",""profile_name"":""Klaus_Arminius""}",,,,blue,1483893386817986574,,2025-07-24T01:48:43.695Z,"{""url"":""https://x.com/AncestralVril/status/1800972403138494519""}",,,,
1852435615230411054,ireallyhateyou,B.M.,"NO FUCKING WAY.Judeo-NAZIS to the full extent of the term. I wonder what's their equivalent to 88.https://t.co/vuD31AahQ5The graffiti in the cover photo, BTW, says ""Likud is dead - Kahane lives""",2024-11-01T19:40:41.000Z,"[""https://pbs.twimg.com/media/GbUsYAeXUAA7P9U.jpg""]",https://x.com/ireallyhateyou/status/1852435615230411054,"{""post_id"":""1852421015298613587"",""profile_id"":""FahAunty"",""profile_name"":""Aunty Fah 🇵🇸 #IStandWithPalestine"",""data_posted"":""2017-05-13T11:28:26.000Z"",""url"":""https://x.com/FahAunty/status/1852421015298613587"",""description"":""@IbnNacer @real_IHN_isback @Bouch3ar1003 @ireallyhateyou What can anyone expect from someone who paraphrases the most popular white supremacist slogan \""We must secure...\"" coined by a member of the white supremacist terror group The Order, David Lane, in their bio. https://t.co/OjrO7Y321X"",""photos"":[""https://pbs.twimg.com/media/GbUdW4-XIAAG2cy.png""],""videos"":null}",,8,62,279,9553,https://en.m.wikipedia.org/wiki/Fourteen_Words,,64313,"Anti-Zionist Hebrew from occupied Palestine. Currently in exile.
🇵🇸🇵🇸🇵🇸
Sometimes I'm available at
ireallyhateyou1948 (at) gmail (dot) com

RT≠endorsement",73183,https://pbs.twimg.com/profile_images/1794333568241418240/wZ1ciU3-_normal.jpg,1948,FALSE,3,36,"{""post_id"":null,""profile_id"":""40541586"",""profile_name"":""B.M.""}",,,,blue,40541586,,2025-07-24T01:48:43.697Z,"{""url"":""https://x.com/ireallyhateyou/status/1852435615230411054""}",,,,
1768656358839107937,Yamnayanage,HandsomeHilterian,I don’t beleeb in low energy HWhyte nationalism. I’m an Aryan supremacist and beleeb in the extermination of hundreds of millions.,2024-03-15T15:11:50.000Z,,https://x.com/Yamnayanage/status/1768656358839107937,"{""post_id"":null,""profile_id"":null,""profile_name"":null,""data_posted"":null,""url"":null,""description"":null,""photos"":null,""videos"":null}",,2,29,346,31307,,,14181,Returning to an ethical suprastructure for a radically aristocratic way of (satirical) thinking. Read BRONZE AGE MINDSET,10930,https://pbs.twimg.com/profile_images/1608555243238834177/Qikn-dXG_normal.jpg,2235,FALSE,2,193,"{""post_id"":null,""profile_id"":""1318767673753391108"",""profile_name"":""HandsomeHilterian""}",,"[{""video_url"":""https://video.twimg.com/ext_tw_video/1768656067569844224/pu/vid/avc1/720x900/Lb64ip6W3AwXbZ8o.mp4?tag=12"",""duration"":13673}]",,,1318767673753391108,,2025-07-24T01:48:43.701Z,"{""url"":""https://x.com/Yamnayanage/status/1768656358839107937""}",,,,
1926661381039759812,OurEurope1939,OurEurope ᛏ ᚢ ᚦ,What do you think of the AtomWaffen Division?,2025-05-25T15:27:23.000Z,,https://x.com/OurEurope1939/status/1926661381039759812,"{""post_id"":null,""profile_id"":null,""profile_name"":null,""data_posted"":null,""url"":null,""description"":null,""photos"":null,""videos"":null}",,2,0,4,522,,,1230,Join Your Folk Today: https://t.co/EUhhf24nMf // Governor of @TheOfficialAIC // Boreanist National Socialism // Education // Autarky Enthusiast,1333,https://pbs.twimg.com/profile_images/1946249469252476942/hnkjb8vi_normal.jpg,1408,FALSE,0,0,"{""post_id"":null,""profile_id"":""1908684397064441856"",""profile_name"":""OurEurope ᛏ ᚢ ᚦ""}",,,,,1908684397064441856,,2025-07-24T01:48:43.762Z,"{""url"":""https://x.com/OurEurope1939/status/1926661381039759812""}",,,,
1714032884137247096,AGHamilton29,AG,"Evil scumbags. This is what I’m talking about. They are celebrating the genocidal murder of babies, women, and children. If it was targeted at anyone other than Jews, everyone would recognize how evil this is.",2023-10-16T21:37:39.000Z,,https://x.com/AGHamilton29/status/1714032884137247096,"{""post_id"":""1713687680280641596"",""profile_id"":""samaberman"",""profile_name"":""Sam Aberman"",""data_posted"":""2013-06-21T02:38:09.000Z"",""url"":""https://x.com/samaberman/status/1713687680280641596"",""description"":""Cornell University Professor Russell Rickford speaking about Hamas terrorist attacks. Shameful @Cornell. https://t.co/xv1dTqGymy"",""photos"":null,""videos"":[{""url"":""https://video.twimg.com/ext_tw_video/1713687626031448065/pu/vid/avc1/480x848/VlwTElVaJCn5EhnU.mp4?tag=12"",""duration"":24333}]}",,53,330,1746,134478,,,204533,Views expressed here only represent myself.,99362,https://pbs.twimg.com/profile_images/1107059422726144010/t8CHnjER_normal.png,1351,FALSE,9,41,"{""post_id"":null,""profile_id"":""116835497"",""profile_name"":""AG""}",,,"[{""video_url"":null,""duration"":24333}]",blue,116835497,,2025-07-24T01:48:43.774Z,"{""url"":""https://x.com/AGHamilton29/status/1714032884137247096""}",,,,
1943750950373797890,Zaryanvolkspart,Zaryan People's Party,YOUR NATION NEEDS YOU#ongezellig #ZaryanLivesMatter,2025-07-11T19:15:14.000Z,"[""https://pbs.twimg.com/media/GvmXL_yW8AIZloJ.jpg""]",https://x.com/Zaryanvolkspart/status/1943750950373797890,"{""post_id"":null,""profile_id"":null,""profile_name"":null,""data_posted"":null,""url"":null,""description"":null,""photos"":null,""videos"":null}",,9,9,28,1748,,"[""ongezellig"",""ZaryanLivesMatter""]",40,"revolutie, ras, natie.
voor de rechten van het Zaryan-volk
#ZaryanLivesMatter",33,https://pbs.twimg.com/profile_images/1945881778675142663/OxG7mCG9_normal.jpg,9,FALSE,4,9,"{""post_id"":null,""profile_id"":""1920538372847681536"",""profile_name"":""Zaryan People's Party""}",,,,,1920538372847681536,,2025-07-24T01:48:43.778Z,"{""url"":""https://x.com/ZPP_88/status/1943750950373797890""}",,,,
1947819563007017098,GnDsville,GrahamAndDoddsville,"@almaforarizona They embrace “Globalize the Intifada” and pose with a man who refuses to condemn terrorist rapers starving their own ppl. They believe that they are morally superior and aren’t antisemitic bigoted Nazis 2.0.  The question is: Are they ignorant, stupid or just plain evil?",2025-07-23T00:42:27.000Z,,https://x.com/GnDsville/status/1947819563007017098,"{""post_id"":null,""profile_id"":null,""profile_name"":null,""data_posted"":null,""url"":null,""description"":null,""photos"":null,""videos"":null}","[{""profile_id"":""979140480096071680"",""profile_name"":""(((Rep.Alma Hernandez)))"",""url"":""https://x.com/almaforarizona"",""biography"":null,""is_verified"":null,""following"":null,""followers"":null}]",0,0,1,89,,,18843,"Value Investor, Securities Analyst, Columbia Business School Graduate, Buffett Groupie, All-Round Value Junkie, Music Lover, Drummer and Father",12312,https://pbs.twimg.com/profile_images/1194254633/cropped-Security-Analysis2_normal.jpg,889,FALSE,0,0,"{""post_id"":""1947806190446252254"",""profile_id"":""979140480096071680"",""profile_name"":""almaforarizona""}",,,,blue,979140480096071680,,2025-07-24T01:48:43.801Z,"{""url"":""https://x.com/GnDsville/status/1947819563007017098""}",,,,
1947806367554675127,Guillersuski89,GUILLERMOSTRAIGHT🏁,"My name is Guillermo Hartwell Alvarez. I live 1488, berlin Germany. If your watching this video, i'm probably dead. Killed by the membres of Tanisten Nationale Socialisten.",2025-07-22T23:50:01.000Z,,https://x.com/Guillersuski89/status/1947806367554675127,"{""post_id"":null,""profile_id"":null,""profile_name"":null,""data_posted"":null,""url"":null,""description"":null,""photos"":null,""videos"":null}",,0,0,0,30,,,495,"hincha de @rosariocentral alias EL CAPO DE SUDAMERICA, HOMBRE DE NACIMIENTO, ATEO, HETEROSEXUAL, DE DERECHA FANATICO DEL ASADO,
TENDENCIASCARC HIZO EL BANNER",7406,https://pbs.twimg.com/profile_images/1947515868679716864/6ySej0cd_normal.jpg,1297,FALSE,0,0,"{""post_id"":null,""profile_id"":""1738658201707347968"",""profile_name"":""GUILLERMOSTRAIGHT🏁""}",,,,,1738658201707347968,,2025-07-24T01:48:43.818Z,"{""url"":""https://x.com/Guillersuski89/status/1947806367554675127""}",,,,
1831310890567614577,ramzpaul,RAMZPAUL,"@BaykalSheikh Territories that were previously part of Germany (prior to WW1) and who had a huge ethnic German population. Hiter had no desire to ""take over the world."" That is childish propaganda.",2024-09-04T12:38:35.000Z,,https://x.com/ramzpaul/status/1831310890567614577,"{""post_id"":null,""profile_id"":null,""profile_name"":null,""data_posted"":null,""url"":null,""description"":null,""photos"":null,""videos"":null}","[{""profile_id"":""1486926456445935618"",""profile_name"":""Baykal"",""url"":""https://x.com/BaykalSheikh"",""biography"":null,""is_verified"":null,""following"":null,""followers"":null}]",95,11,357,12201,,,162076,"A proud hillbilly. 
YouTube channel: https://t.co/f0ZX2xXOPr 
Rumble: https://t.co/aVLC1hv48m
Support me at: https://t.co/ucrJG0hBrW",100221,https://pbs.twimg.com/profile_images/1591074150696865792/4tQhJQFu_normal.jpg,385,FALSE,5,13,"{""post_id"":""1831310196783648995"",""profile_id"":""1486926456445935618"",""profile_name"":""BaykalSheikh""}",,,,blue,1486926456445935618,,2025-07-24T01:48:43.844Z,"{""url"":""https://x.com/ramzpaul/status/1831310890567614577""}",,,,
1948119898053279789,Truthtellerftm,Truth_teller 🇷🇺,@EYakoby Communism is Jewish. The jews said so.,2025-07-23T20:35:52.000Z,"[""https://pbs.twimg.com/media/GwkcuP_XcAI-SJZ.jpg""]",https://x.com/Truthtellerftm/status/1948119898053279789,"{""post_id"":null,""profile_id"":null,""profile_name"":null,""data_posted"":null,""url"":null,""description"":null,""photos"":null,""videos"":null}","[{""profile_id"":""1249148165112160257"",""profile_name"":""Eyal Yakoby"",""url"":""https://x.com/EYakoby"",""biography"":null,""is_verified"":null,""following"":null,""followers"":null}]",7,25,144,1512,,,109974,Retweets are not endorsements! buy me a coffee: https://t.co/S2AofRD6HS @Truthtellerftm on substack. btc: 13CoSW9K5dHq1yQUNTWyDqcU9YRP4wWSBp,47289,https://pbs.twimg.com/profile_images/1788127630996201474/kITDtHy__normal.jpg,2050,FALSE,3,8,"{""post_id"":""1948113782045049252"",""profile_id"":""1249148165112160257"",""profile_name"":""EYakoby""}",,,,blue,1249148165112160257,,2025-07-24T01:48:43.877Z,"{""url"":""https://x.com/Truthtellerftm/status/1948119898053279789""}",,,,
1818780382252179854,ForWesternkind,Conor,@Klaus_Arminius Antiwhite tyranny. Multiracialism and White erasure lead to a biospiritual arms race that governments attempt to manage by oppressing the native Whites.,2024-07-31T22:46:49.000Z,,https://x.com/ForWesternkind/status/1818780382252179854,"{""post_id"":null,""profile_id"":null,""profile_name"":null,""data_posted"":null,""url"":null,""description"":null,""photos"":null,""videos"":null}","[{""profile_id"":""1483893386817986574"",""profile_name"":""Klaus Arminius"",""url"":""https://x.com/Klaus_Arminius"",""biography"":null,""is_verified"":null,""following"":null,""followers"":null}]",3,27,444,10406,,,4147,Irish wellbeing ☘️ White wellbeing 🤍 Westernkind: we are one people of many nations and cultures. 🗺️ Antiwhiteism: the only evil that's legal. #NoWhiteGuilt,18331,https://pbs.twimg.com/profile_images/1652800353656614914/FZ_gzsoo_normal.jpg,293,FALSE,0,4,"{""post_id"":""1818778784847581243"",""profile_id"":""1483893386817986574"",""profile_name"":""Klaus_Arminius""}",,,,blue,1483893386817986574,,2025-07-24T01:48:43.881Z,"{""url"":""https://x.com/ForWesternkind/status/1818780382252179854""}",,,,
1759028889941098672,AraquelBloss,Araquel Bloss,"@ShaykhSulaiman Race supremacy, ethnostate, dehumanization, starvation, ethnic cleansing and genocide. Nazism and Zionism are from the same era, their ideologies and tactics are brothers.",2024-02-18T01:35:43.000Z,"[""https://pbs.twimg.com/media/GGlTcyiXQAAKw5m.jpg""]",https://x.com/AraquelBloss/status/1759028889941098672,"{""post_id"":null,""profile_id"":null,""profile_name"":null,""data_posted"":null,""url"":null,""description"":null,""photos"":null,""videos"":null}","[{""profile_id"":""1291128494"",""profile_name"":""Sulaiman Ahmed"",""url"":""https://x.com/ShaykhSulaiman"",""biography"":null,""is_verified"":null,""following"":null,""followers"":null}]",35,35,365,5652,,,15777,,49593,https://pbs.twimg.com/profile_images/1909753725855404032/hIpUMYQu_normal.jpg,7238,FALSE,1,2,"{""post_id"":""1759027199775277250"",""profile_id"":""1291128494"",""profile_name"":""ShaykhSulaiman""}",,,,blue,1291128494,,2025-07-24T01:48:43.901Z,"{""url"":""https://x.com/AraquelBloss/status/1759028889941098672""}",,,,
1785975242239975649,SamParkerSenate,Sam Parker 🇺🇲,"📺🇩🇪 THEY MADE ME DO THIS! 🔊Since j -ws are about to outlaw any & all speech they don't like--it's become absolutely necessary to post speech that they'll hate & find offensive.You've never heard AH's final radio address in the original English. But, he had something very interesting to say:""If Germany today were the Germany envisaged by the Versailles treaty, Europe would long since have been swept away by the hurricane from central Asia. It is hardly necessary to argue with those eternal blockheads who maintain that an unarmed Germany would--owing to its impotence--not have become a victim of this j -wish international world plot. The fight against this j -wish Asiatic bolshevism had been raging long before National Socialism came into power. The only reason why it had not already overrun Europe during the years 1919-20 was that it was then itself too weak and too poorly armed.""if you love free speech, listen to the speech in its entirety:",2024-05-02T10:10:54.000Z,,https://x.com/SamParkerSenate/status/1785975242239975649,"{""post_id"":null,""profile_id"":null,""profile_name"":null,""data_posted"":null,""url"":null,""description"":null,""photos"":null,""videos"":null}",,99,496,1501,124465,,,174666,"Ran for US Senate-UT. America 1st. MAGLA-Make American Government Local Again. Repeal 16th/17th/19th/26th, Reapportionment Act of 1929 & Immigration Act of 1965",107954,https://pbs.twimg.com/profile_images/1363243780980183044/9kMTAeVl_normal.jpg,1467,FALSE,43,870,"{""post_id"":null,""profile_id"":""965451112395415552"",""profile_name"":""Sam Parker 🇺🇲""}",,"[{""video_url"":""https://video.twimg.com/amplify_video/1785974299914129409/vid/avc1/1280x720/fOFht360kHHsYwER.mp4?tag=14"",""duration"":886134}]",,,965451112395415552,,2025-07-24T01:48:43.904Z,"{""url"":""https://x.com/SamParkerSenate/status/1785975242239975649""}",,,,
1912630773456285831,permabulla,🤍permabulla🤍,“Nothing other than total Aryan victory will suffice” - Nick FuentesAmerica First Ep. 1488 is TONIGHT!,2025-04-16T22:14:46.000Z,,https://x.com/permabulla/status/1912630773456285831,"{""post_id"":null,""profile_id"":null,""profile_name"":null,""data_posted"":null,""url"":null,""description"":null,""photos"":null,""videos"":null}",,103,526,5537,157317,,,77958,say it like it is | turn on notis | 👇🏻follow my telegram,16822,https://pbs.twimg.com/profile_images/1882537731223425024/y9ATfEXn_normal.jpg,515,FALSE,27,1117,"{""post_id"":null,""profile_id"":""1214304096955428865"",""profile_name"":""🤍permabulla🤍""}",,"[{""video_url"":""https://video.twimg.com/amplify_video/1912630718615748608/vid/avc1/1280x720/QvecOvsRLTqF9Hb0.mp4?tag=16"",""duration"":35200}]",,blue,1214304096955428865,,2025-07-24T01:48:43.948Z,"{""url"":""https://x.com/permabulla/status/1912630773456285831""}",,,,
1944834304057737283,nxt888,Sony Thang,"No, Amiran.You’re not the shield of humanity.You’re the spear tip of apartheid.The world doesn’t sleep peacefully because you’re ""awake.""It wakes up to footage of your bombs flattening homes.Of your soldiers executing children.Of your drones circling refugee camps like vultures.Your so-called ""border"" is someone else’s village.Your wall was built on someone else’s land.And your front line is a lie carved into stolen earth.You are not protecting anyone.You are not standing for peace.You are not fighting alone, because you were never attacked alone.You are the military extension of a settler colony.A client of empires who arm your impunity and fund your illusions.Don’t speak to us of humanity while Gazan mothers dig through rubble for their children.Don’t speak of protection while you snipe journalists, bomb ambulances, and target medics.You are not a defender.You are an occupier.And no amount of slogans, hashtags, or blue hearts will cleanse the blood.The land you claim remembers another name.And the people you displaced are still here.Still breathing.Still fighting.You are not the front line of humanity.You are its test.And one day, when your walls fall,You’ll see exactly what side of history you were standing on.",2025-07-14T19:00:06.000Z,,https://x.com/nxt888/status/1944834304057737283,"{""post_id"":""1944622890940289063"",""profile_id"":""Amiran_Zizovi"",""profile_name"":""AMIRAN 🇮🇱"",""data_posted"":""2023-11-11T10:12:31.000Z"",""url"":""https://x.com/Amiran_Zizovi/status/1944622890940289063"",""description"":""The world sleeps peacefully because we are awake.\nWhoever thinks that Israel is fighting alone should come to the border for a day. Our children are protecting your children. Our border is the front line of all humanity.\nTake a good look: behind this wall is you. Continue to https://t.co/coqsBs6E0L"",""photos"":[""https://pbs.twimg.com/media/GvxGOtCXoAEPg0s.jpg""],""videos"":null}",,97,1378,4012,71350,,,75826,"ʙᴏʀɴ ɪɴ ᴠɪᴇᴛɴᴀᴍ ɢʀᴇᴡ ᴜᴘ ɪɴ ᴇᴜʀᴏᴘᴇ ʟɪᴠᴇ ɪɴ ᴀꜱɪᴀ

https://t.co/U1Tvheffi9",13676,https://pbs.twimg.com/profile_images/1603685427159846912/xq6gObk3_normal.jpg,519,FALSE,33,161,"{""post_id"":null,""profile_id"":""24876821"",""profile_name"":""Sony Thang""}",,,,blue,24876821,,2025-07-24T01:48:43.969Z,"{""url"":""https://x.com/nxt888/status/1944834304057737283""}",,,,
1946238298529153309,dustyf1nish,CANARY,literally hundreds of thousands of american families that deserve the same fate,2025-07-18T15:59:04.000Z,,https://x.com/dustyf1nish/status/1946238298529153309,"{""post_id"":""1945939059932831759"",""profile_id"":""HumbleFlow"",""profile_name"":""Humble Flow"",""data_posted"":""2021-07-15T15:09:23.000Z"",""url"":""https://x.com/HumbleFlow/status/1945939059932831759"",""description"":""Never forgive the Bolsheviks for what they did to the Romanov family.\n\nToday, 107 years ago. https://t.co/zpeDe3mlwz"",""photos"":[""https://pbs.twimg.com/media/GwFWluRXcAABnRu.jpg""],""videos"":null}",,134,127,1885,135071,,,415,hey buddy would you like to buy a watch real cheap,20441,https://pbs.twimg.com/profile_images/1597789016211988480/LihL-fyY_normal.jpg,632,FALSE,42,118,"{""post_id"":null,""profile_id"":""1078085923919798273"",""profile_name"":""CANARY""}",,,,,1078085923919798273,,2025-07-24T01:48:43.973Z,"{""url"":""https://x.com/dustyf1nish/status/1946238298529153309""}",,,,
