id,user_posted,name,description,date_posted,photos,url,quoted_post,tagged_users,replies,reposts,likes,views,external_url,hashtags,followers,biography,posts_count,profile_image_link,following,is_verified,quotes,bookmarks,parent_post_details,external_image_urls,videos,external_video_urls,verification_type,user_id,context_added,timestamp,input,error,error_code,warning,warning_code
1779649132182765664,MarioNawfal,Mario Nawfal,"🇮🇱ISRAEL: IRGC IS THE NEW THIRD REICH“For years the world has watched the rise of a Shiite Islamic Reich, yet just like during the rise of Nazism, the world has been silent.Why has the UN rolled out the red carpet for these genocidal jihadists?The mask of Iranian deniability has been removed. No more hidding and no more bluffing.”Source: UN",2024-04-14T23:13:12.000Z,"[""https://pbs.twimg.com/media/GLKVZJLXIAAijrr.jpg"",""https://pbs.twimg.com/media/GLKVZJLWMAAXBby.jpg""]",https://x.com/MarioNawfal/status/1779649132182765664,"{""post_id"":""1779643517226078511"",""profile_id"":""MarioNawfal"",""profile_name"":""Mario Nawfal"",""data_posted"":""2020-10-22T14:42:25.000Z"",""url"":""https://x.com/MarioNawfal/status/1779643517226078511"",""description"":""🇮🇱ISRAEL: IRAN IS A PIRATE STATE!\n\n“Iran is not only a terrorist state, it is a pirate state!”\n\nSource: UN https://t.co/Qyt505mmYs"",""photos"":[""https://pbs.twimg.com/media/GLKP_TXWQAAWClt.jpg""],""videos"":[{""url"":""https://video.twimg.com/amplify_video/1779643120537210880/vid/avc1/848x480/N3CEaYw3hLcDhgsQ.mp4?tag=14"",""duration"":7931}]}",,132,174,736,375526,,,2285499,Largest Show on X | Founder @ibcgroupio | Investor 700+ Startups,149423,https://pbs.twimg.com/profile_images/1938244629071015936/UwtzYY-R_normal.jpg,48637,FALSE,16,54,"{""post_id"":null,""profile_id"":""1319287761048723458"",""profile_name"":""Mario Nawfal""}",,"[{""video_url"":""https://video.twimg.com/amplify_video/1779649062146383872/vid/avc1/848x464/xph8GcGpK-DgyMsD.mp4?tag=14"",""duration"":98543}]","[{""video_url"":null,""duration"":7931}]",blue,1319287761048723458,,2025-07-24T01:57:53.543Z,"{""url"":""https://x.com/MarioNawfal/status/1779649132182765664""}",,,,
1740999335826092119,aldamu_jo,Irlandarra,50 million were Slaughtered to make America Great.How many millions of Palestinians do we have to kill to make Israel great?.#StopTheEthnicGenocide #FreePalestine #StopGenocideInGaza,2023-12-30T07:32:42.000Z,"[""https://pbs.twimg.com/media/GClFqrzWkAAJ2sy.jpg""]",https://x.com/aldamu_jo/status/1740999335826092119,"{""post_id"":null,""profile_id"":null,""profile_name"":null,""data_posted"":null,""url"":null,""description"":null,""photos"":null,""videos"":null}",,135,1009,1419,40712,,"[""StopTheEthnicGenocide"",""FreePalestine"",""StopGenocideInGaza""]",86893,"Some people call it democracy
electing a dictator every 4 years.          

https://t.co/IWx99cH6Td

Tiocfaidh ár lá! Euskal Herria Askatu! فلسطين الحرة",32662,https://pbs.twimg.com/profile_images/1176873787041734657/h3tz1JwW_normal.jpg,16778,FALSE,46,30,"{""post_id"":null,""profile_id"":""1168233995945033728"",""profile_name"":""Irlandarra""}",,,,blue,1168233995945033728,,2025-07-24T01:57:53.729Z,"{""url"":""https://x.com/aldamu_jo/status/1740999335826092119""}",,,,
1946101730736742826,GamerApocalymon,Apocalymon ☭,"My position on ""globalize the intifada"" is simple; no one, anywhere in the world, should feel safe to support the mass slaughter of Gaza's population. If anything bad happens to you as a result of such support, you more than deserved it.",2025-07-18T06:56:24.000Z,,https://x.com/GamerApocalymon/status/1946101730736742826,"{""post_id"":null,""profile_id"":null,""profile_name"":null,""data_posted"":null,""url"":null,""description"":null,""photos"":null,""videos"":null}",,0,0,1,13,,,115,"My only cause is the emancipation of all humanity. Side account for politics, originated as #gamergate acc. Revolutionary socialist. American-born exile.",11032,https://pbs.twimg.com/profile_images/506885895039897600/ILtJ5Xu6_normal.jpeg,37,FALSE,0,0,"{""post_id"":null,""profile_id"":""2786523500"",""profile_name"":""Apocalymon ☭""}",,,,,2786523500,,2025-07-24T01:57:53.745Z,"{""url"":""https://x.com/GamerApocalymon/status/1946101730736742826""}",,,,
1946840073481433204,Markela_p_,Markela Panegyres,Globalise the intifada. Stop Israel’s genocide.,2025-07-20T07:50:18.000Z,,https://x.com/Markela_p_/status/1946840073481433204,"{""post_id"":""1946807189114630330"",""profile_id"":""MosabAbuToha"",""profile_name"":""Mosab Abu Toha"",""data_posted"":""2011-12-08T13:18:08.000Z"",""url"":""https://x.com/MosabAbuToha/status/1946807189114630330"",""description"":""UNBELIEVABLE!!!!!!\nIsrael is now ordering people to evacuate large parts of DER EL-BALAH!!!\n\nSomeone needs to fucking stop israel.\n\nFuck israel!!!! https://t.co/IHKnGkW5Wd"",""photos"":[""https://pbs.twimg.com/media/GwRy0fUXkAEsbVO.jpg""],""videos"":null}",,0,1,2,102,,,412,Free Palestine 🇵🇸 🇱🇧🔻Artist. Socialism  or extinction.,2225,https://pbs.twimg.com/profile_images/1324552885535846400/RFgGCQq2_normal.jpg,2053,FALSE,0,0,"{""post_id"":null,""profile_id"":""222019954"",""profile_name"":""Markela Panegyres""}",,,,,222019954,,2025-07-24T01:57:53.640Z,"{""url"":""https://x.com/Markela_p_/status/1946840073481433204""}",,,,
1935469516894650820,susanabulhawa,susan abulhawa | سوزان ابو الهوى,"no, your sense of exceptionalism is appalling. Palestinians have been trying to survive your genocidal jewish supremacy since we first made the mistake of taking pity on you and letting you into our country and homes. Globalize the intifada is a cry for universal freedom and liberation. You don’t like that because you’re oppressors and colonizers.",2025-06-18T22:47:46.000Z,,https://x.com/susanabulhawa/status/1935469516894650820,"{""post_id"":""1935101964443955392"",""profile_id"":""SaraL4man"",""profile_name"":""Sara Forman"",""data_posted"":""2013-08-01T02:39:57.000Z"",""url"":""https://x.com/SaraL4man/status/1935101964443955392"",""description"":""It is absolutely appalling for Zohran to compare the Jews of Warsaw with the terrorism associated with globalizing the intifada. Warsaw's Jews were not trying to overthrow western civilization, they were fighting to delay their certain deaths in the gas chambers of Treblinka."",""photos"":null,""videos"":null}",,12,284,913,18292,,,35623,"demographic threat, hyphenated writer, girl-mom, dog-mom, vegan, exile, indigenous daughter of Jerusalem (with receipts, unlike the colonizers)",2273,https://pbs.twimg.com/profile_images/1838199451858444288/dyUBCC1u_normal.jpg,247,FALSE,4,46,"{""post_id"":null,""profile_id"":""1838199110312300544"",""profile_name"":""susan abulhawa | سوزان ابو الهوى""}",,,,blue,1838199110312300544,,2025-07-24T01:57:54.131Z,"{""url"":""https://x.com/susanabulhawa/status/1935469516894650820""}",,,,
1946990772005519467,Lockedown_,Fuck Genocide - Human Rights for All,"Biden started it.Trump continues it.The so-called state of Isntreal is doing what Nazi Germany did to Palestine.The entire ""West"" aka white colonizer countries, is helping Isntreal in genocide.",2025-07-20T17:49:08.000Z,,https://x.com/Lockedown_/status/1946990772005519467,"{""post_id"":""1946901112453304471"",""profile_id"":""sahouraxo"",""profile_name"":""sarah"",""data_posted"":""2015-07-25T18:41:29.000Z"",""url"":""https://x.com/sahouraxo/status/1946901112453304471"",""description"":""BREAKING:\n\nIsrael has committed yet another horrific massacre.\n\nOver 50 starving Palestinians were shot dead in northern Gaza — they were searching for flour.\n\nThese massacres are happening every single day.\n\nIsrael is starving civilians. Then gunning them down.\n\nHolocaust."",""photos"":null,""videos"":null}",,0,0,2,68,,,2406,"Actions, not just words. He/him. LGBTQIA+ friendly. Black lives still matter. Free Palestine until its free.",116124,https://pbs.twimg.com/profile_images/1636606503284281344/mLNyZ6xk_normal.jpg,1607,FALSE,0,0,"{""post_id"":null,""profile_id"":""190667109"",""profile_name"":""Fuck Genocide - Human Rights for All""}",,,,,190667109,,2025-07-24T01:57:53.596Z,"{""url"":""https://x.com/Lockedown_/status/1946990772005519467""}",,,,
1947759595122004049,ProtectPal,Protect Palestine,"@stonewrapper @ousmannoor By your logic, delete your fucking X account and go fight.  Except you don't, you just troll and attack people ""on your team"" online. Burn in hell you prick. Last message I'm writing to you.",2025-07-22T20:44:09.000Z,,https://x.com/ProtectPal/status/1947759595122004049,"{""post_id"":null,""profile_id"":null,""profile_name"":null,""data_posted"":null,""url"":null,""description"":null,""photos"":null,""videos"":null}","[{""profile_id"":""1048750199189827585"",""profile_name"":""Upscale Recycled Jewelry,"",""url"":""https://x.com/stonewrapper"",""biography"":null,""is_verified"":null,""following"":null,""followers"":null},{""profile_id"":""52010756"",""profile_name"":""Ousman Babir Noor"",""url"":""https://x.com/ousmannoor"",""biography"":null,""is_verified"":null,""following"":null,""followers"":null}]",1,0,0,41,,,9645,A global campaign advocating for an international military intervention to stop Israel's genocide of Palestinians. Take action to #ProtectPalestine,296,https://pbs.twimg.com/profile_images/1908576801170821120/u9JOvdf4_normal.jpg,2,FALSE,1,0,"{""post_id"":""1947755994089709743"",""profile_id"":""1048750199189827585"",""profile_name"":""stonewrapper""}",,,,blue,1048750199189827585,,2025-07-24T01:57:53.645Z,"{""url"":""https://x.com/ProtectPal/status/1947759595122004049""}",,,,
1947904923624214669,RohitMan1967,Rohit Mandal,"Go China,Spain,Ireland,SA,N Korea..rest are shameless.Stop this Rabid Genocide by @IDF and @netanyahu backed by US @realDonaldTrump ,@UK",2025-07-23T06:21:38.000Z,"[""https://pbs.twimg.com/media/GwhZNFxbEAEpeem.jpg""]",https://x.com/RohitMan1967/status/1947904923624214669,"{""post_id"":null,""profile_id"":null,""profile_name"":null,""data_posted"":null,""url"":null,""description"":null,""photos"":null,""videos"":null}","[{""profile_id"":""18576537"",""profile_name"":""Israel Defense Forces"",""url"":""https://x.com/IDF"",""biography"":null,""is_verified"":null,""following"":null,""followers"":null},{""profile_id"":""17061263"",""profile_name"":""Benjamin Netanyahu - בנימין נתניהו"",""url"":""https://x.com/netanyahu"",""biography"":null,""is_verified"":null,""following"":null,""followers"":null},{""profile_id"":""25073877"",""profile_name"":""Donald J. Trump"",""url"":""https://x.com/realDonaldTrump"",""biography"":null,""is_verified"":null,""following"":null,""followers"":null}]",0,0,0,16,,,131,A zest for travelling food drink and a lot of chill and fun,3848,https://pbs.twimg.com/profile_images/1905463968149467136/oRZg_YOy_normal.jpg,573,FALSE,0,0,"{""post_id"":null,""profile_id"":""820241044184776705"",""profile_name"":""Rohit Mandal""}",,,,,820241044184776705,,2025-07-24T01:57:53.616Z,"{""url"":""https://x.com/RohitMan1967/status/1947904923624214669""}",,,,
1948063422161076296,Shortpacks,88,This is the personification of what holds back Europe to respond to the weaponized mass replacement scheme.,2025-07-23T16:51:27.000Z,,https://x.com/Shortpacks/status/1948063422161076296,"{""post_id"":""1947997028484575262"",""profile_id"":""LeftwaffenWatch"",""profile_name"":""Leftwaffen-Watch ⬜️"",""data_posted"":""2021-07-23T12:17:09.000Z"",""url"":""https://x.com/LeftwaffenWatch/status/1947997028484575262"",""description"":""The face of imminent Western destruction @CllrNathalieB \n\nVirtue signalling, suicidally empathetic, white leftst women. https://t.co/hSottLvnoo"",""photos"":[""https://pbs.twimg.com/media/GwisyKdWEAA6aiv.png""],""videos"":null}",,0,0,0,14,,,119,"Programmer, Open Source, Decentralized Infrastructure, AI. The West needs a cultural rebirth.",3437,https://pbs.twimg.com/profile_images/1947478360042455040/GaX2oxQa_normal.jpg,798,FALSE,0,0,"{""post_id"":null,""profile_id"":""1808408468010983424"",""profile_name"":""88""}",,,,,1808408468010983424,,2025-07-24T01:57:53.518Z,"{""url"":""https://x.com/Shortpacks/status/1948063422161076296""}",,,,
1736017212094181582,agelender,Amanda Gelender🔮,"Zionism was a fringe nat’l movement within Judaism &amp; when its interests aligned with western imperialists, “Israel” was born

Zionism is a fascist wing of Judaism that hijacked the faith &amp; now dominates it: Anti-Zionists have always existed &amp; rejected the settler-colony of Israel",2023-12-16T13:35:31.000Z,,https://x.com/agelender/status/1736017212094181582,"{""post_id"":null,""profile_id"":null,""profile_name"":null,""data_posted"":null,""url"":null,""description"":null,""photos"":null,""videos"":null}",,65,419,1134,32349,,,34490,🪐 Writer 🪂 Jewish anti-zionist ✨Abolition | Film/TV,16864,https://pbs.twimg.com/profile_images/1660587583133417475/yBb35BgL_normal.jpg,2344,FALSE,12,73,"{""post_id"":null,""profile_id"":""2858419898"",""profile_name"":""Amanda Gelender🔮""}",,,,,2858419898,,2025-08-02T21:40:27.220Z,"{""url"":""https://x.com/agelender/status/1736017212094181582""}",,,,
1935381005608583318,havenosecrets,Zog Zoggy🇺🇸,"KARMA

The Day When Jews Stopped Laughing At The Palestinians Whom They Mistreated, Butchered, Starved In Their Own Ancient Palestinian Jew-Occupied Land Since 1967.

#IsraelIranConflict #GazaGenocide #GazaHolocaust #Berlin #NewYorkCity #Tokyo #Jakarta #Paris #London #Istanbul",2025-06-18T16:56:04.000Z,"[""https://pbs.twimg.com/media/GtvYTOYWgAAQDVH.png""]",https://x.com/havenosecrets/status/1935381005608583318,"{""post_id"":null,""profile_id"":null,""profile_name"":null,""data_posted"":null,""url"":null,""description"":null,""photos"":null,""videos"":null}",,2,1,4,1640,,"[""IsraelIranConflict"",""GazaGenocide"",""GazaHolocaust"",""Berlin"",""NewYorkCity"",""Tokyo"",""Jakarta"",""Paris"",""London"",""Istanbul""]",1647,All-Albanian Boy Here & I’m Certainly Not Going Through Life With One Hand Tied Behind My Back.,46836,https://pbs.twimg.com/profile_images/1868886396049432576/3rMLspp-_normal.jpg,965,FALSE,0,0,"{""post_id"":null,""profile_id"":""254762293"",""profile_name"":""Zog Zoggy🇺🇸""}",,,,,254762293,,2025-08-02T21:40:27.295Z,"{""url"":""https://x.com/havenosecrets/status/1935381005608583318""}",,,,
1948178449530564754,KazehikoAmano,Kazehiko Amano,A.Z.A.B - All Zionists Are Bastards #FreePalestine,2025-07-24T00:28:32.000Z,"[""https://pbs.twimg.com/media/GwlR-KuXkAAAu0U.jpg""]",https://x.com/KazehikoAmano/status/1948178449530564754,"{""post_id"":null,""profile_id"":null,""profile_name"":null,""data_posted"":null,""url"":null,""description"":null,""photos"":null,""videos"":null}",,0,0,0,380,,"[""FreePalestine""]",2139,"Kazehiko Amano | Grizzly of Gains 🐻 | I feast on market crashes and thrive in the chaos. Bearish AF, decoding the downturns. FreePalestine 🇵🇸🕊",11977,https://pbs.twimg.com/profile_images/1940882538525818881/jFH_ztsq_normal.jpg,910,FALSE,0,0,"{""post_id"":null,""profile_id"":""1742458902287908865"",""profile_name"":""Kazehiko Amano""}",,,,blue,1742458902287908865,,2025-08-02T21:40:27.303Z,"{""url"":""https://x.com/KazehikoAmano/status/1948178449530564754""}",,,,
1716122535434059874,eaglewhite195,Brandon Green,"#FreePalestine 

The Rothschilds are the Head of the Zionist Snake!",2023-10-22T16:01:11.000Z,,https://x.com/eaglewhite195/status/1716122535434059874,"{""post_id"":null,""profile_id"":null,""profile_name"":null,""data_posted"":null,""url"":null,""description"":null,""photos"":null,""videos"":null}",,1,20,1,294,,"[""FreePalestine""]",609,"I am a Creator, I follow my Chanté {❤️} #MostPopularOutcast /Theurgist",5239,https://pbs.twimg.com/profile_images/1719080561254277120/nu3V632E_normal.jpg,1194,FALSE,2,0,"{""post_id"":null,""profile_id"":""1685128945182580736"",""profile_name"":""Brandon Green""}",,"[{""video_url"":""https://video.twimg.com/ext_tw_video/1716122485379264512/pu/vid/avc1/482x858/qz8nZeVHit_Rvoo0.mp4?tag=12"",""duration"":121300}]",,,1685128945182580736,,2025-08-02T21:40:27.306Z,"{""url"":""https://x.com/eaglewhite195/status/1716122535434059874""}",,,,
1939719261980643487,SholaMos1,Dr Shola Mos-Shogbamimu,"The power of Zionist Jewish lobby - Bob Vylan dropped by agency, US visas revoked &amp; criminal investigation all in 48 hours. Zionists really flexing their control. All for Israel a foreign country, IDF a baby killing state terrorist army &amp; Zionism an evil ideology👏🏽 #DeathToTheIDF",2025-06-30T16:14:44.000Z,"[""https://pbs.twimg.com/media/GutEYq1W0AA1IG3.jpg""]",https://x.com/SholaMos1/status/1939719261980643487,"{""post_id"":null,""profile_id"":null,""profile_name"":null,""data_posted"":null,""url"":null,""description"":null,""photos"":null,""videos"":null}",,1153,6022,19533,644458,,"[""DeathToTheIDF""]",197319,"Author of This Is Why I Resist, Advocate, Political & Women's Rights Activist, Founder @WILPublication, Wife & Mum to 3 girls. Subscribe YouTube Dr Shola Speaks",18437,https://pbs.twimg.com/profile_images/1501712422461128711/jVVCqBmB_normal.jpg,3246,FALSE,219,579,"{""post_id"":null,""profile_id"":""243878865"",""profile_name"":""Dr Shola Mos-Shogbamimu""}",,,,blue,243878865,,2025-08-02T21:40:27.316Z,"{""url"":""https://x.com/SholaMos1/status/1939719261980643487""}",,,,
1713292841223418215,SelimMillah,selim millah,#Gazagenocide #FreeGaza #FreePalaestine #israelterroriststate #IsraelNazi #IsraelApartheidstate #NetanyahuIsAMonster #GazaHolocaust 10/2023 the human are witnessing big genocide and ethnic cleansing in #Gaza by netanyahu the terrorists with the help of #USA #UK #France #Germany,2023-10-14T20:36:59.000Z,"[""https://pbs.twimg.com/media/F8bWvrlXgAAoSW3.jpg""]",https://x.com/SelimMillah/status/1713292841223418215,"{""post_id"":null,""profile_id"":null,""profile_name"":null,""data_posted"":null,""url"":null,""description"":null,""photos"":null,""videos"":null}",,0,1,1,215,,"[""Gazagenocide"",""FreeGaza"",""FreePalaestine"",""israelterroriststate"",""IsraelNazi"",""IsraelApartheidstate"",""NetanyahuIsAMonster"",""GazaHolocaust"",""Gaza"",""USA"",""UK"",""France"",""Germany""]",642,"لقد ولدنا أحرارًا، وسنبقى أحرارًا، إلا من اختار غير ذلك.
We were born free, and we will remain free, except for those who choose otherwise.",71474,https://pbs.twimg.com/profile_images/1714640680587239424/Ah5NvhVH_normal.jpg,553,FALSE,1,0,"{""post_id"":null,""profile_id"":""1420073339503120385"",""profile_name"":""selim millah""}",,,,,1420073339503120385,,2025-08-02T21:40:27.318Z,"{""url"":""https://x.com/SelimMillah/status/1713292841223418215""}",,,,
1745170453801337320,MpeseProud,Proud African,"Thank you Jeremy Corbyn - it shows that not everyone in the west is a proponent of the #US deepstate.

This is encouraging.

#InternationalCourtofJustice 
#SouthAfrica #SouthAfricavsIsrael 
#FreePalestine #Gaza #GazaGenocide #GazaHolocaust",2024-01-10T19:47:14.000Z,,https://x.com/MpeseProud/status/1745170453801337320,"{""post_id"":""1745119474842308794"",""profile_id"":""jacksonhinklle"",""profile_name"":""Jackson Hinkle 🇺🇸"",""data_posted"":""2019-07-18T17:53:59.000Z"",""url"":""https://x.com/jacksonhinklle/status/1745119474842308794"",""description"":""🚨🇵🇸🇬🇧 Jeremy Corbyn will join South Africa's delegation in the case against ISRAEL at International Court of Justice. https://t.co/7h4TEffwr5"",""photos"":[""https://pbs.twimg.com/media/GDfo6dVXkAAfEQP.jpg""],""videos"":null}",,0,1,3,419,,"[""US"",""InternationalCourtofJustice"",""SouthAfrica"",""SouthAfricavsIsrael"",""FreePalestine"",""Gaza"",""GazaGenocide"",""GazaHolocaust""]",2784,"Sobukweist, Bikoist, Fanonist, Nkrumaist, and Sankaraist. Proponent of Pan_Africanism, Non_Racism, and Non_Tribalism. Aiming for the United States Of Africa✋",44006,https://pbs.twimg.com/profile_images/1286687766164758528/Za3VmSrh_normal.jpg,2599,FALSE,0,0,"{""post_id"":null,""profile_id"":""1286687470260760577"",""profile_name"":""Proud African""}",,,,,1286687470260760577,,2025-08-02T21:40:27.331Z,"{""url"":""https://x.com/MpeseProud/status/1745170453801337320""}",,,,
1823637460196479384,Forthleft2,Tim Jones 🇵🇸,"No.
It’s the Israelis again.
This is #Hasbara 
The Zionists are more evil than anyone can imagine. 
They direct all democracies via their parasitised funds. 

#ZOG is ‘Zionist Owned Government’. Like #auspol 
Zionists are filth.
We need to fumigate. 
#Fuckisrael 
#FreePalestine",2024-08-14T08:27:06.000Z,"[""https://pbs.twimg.com/media/GU7cl8PbwAAhdLs.jpg""]",https://x.com/Forthleft2/status/1823637460196479384,"{""post_id"":""1823558000314839435"",""profile_id"":""adequatehousing"",""profile_name"":""UN Special Rapporteur on the right to housing"",""data_posted"":""2012-02-03T19:25:23.000Z"",""url"":""https://x.com/adequatehousing/status/1823558000314839435"",""description"":""It is now clear that it is America itself which is leading genocidal war against the Palestinians. Israel is simply the instrument. All are equally guilty of grave breaches of international law and elementary decency but America is primarily at fault."",""photos"":null,""videos"":null}",,0,8,15,1135,,"[""Hasbara"",""ZOG"",""auspol"",""Fuckisrael"",""FreePalestine""]",10359,Zionism is Nazism. The Nakba was Operation Barbarossa. @forthleft.bsky.https://t.co/6cPPa3SmMm,337070,https://pbs.twimg.com/profile_images/1641939343353987072/CUfKAWRz_normal.jpg,8312,FALSE,1,0,"{""post_id"":null,""profile_id"":""3368822652"",""profile_name"":""Tim Jones 🇵🇸""}",,,,,3368822652,,2025-08-02T21:40:27.337Z,"{""url"":""https://x.com/Forthleft2/status/1823637460196479384""}",,,,
1720717171666415682,CorbynSnap,"Jeremy Corbin MP, Prime Ministerial Parody","I have no idea why the German government is so strongly in favour of the continued existence of Israel, but suspect they are also a puppet regime of the Zionist Rothschilds. Why else? #FreePalestine #Hamas",2023-11-04T08:18:37.000Z,,https://x.com/CorbynSnap/status/1720717171666415682,"{""post_id"":null,""profile_id"":null,""profile_name"":null,""data_posted"":null,""url"":null,""description"":null,""photos"":null,""videos"":null}",,6,2,8,2512,,"[""FreePalestine"",""Hamas""]",33935,MP for Ramallah West (Parody),27579,https://pbs.twimg.com/profile_images/1200417375029518337/ls7dFJm6_normal.jpg,25308,FALSE,0,0,"{""post_id"":null,""profile_id"":""3654128967"",""profile_name"":""Jeremy Corbin MP, Prime Ministerial Parody""}",,"[{""video_url"":""https://video.twimg.com/amplify_video/1720129537361481728/vid/avc1/1080x1080/kPtpJuwY9kX9I7LC.mp4?tag=16"",""duration"":580095}]",,,3654128967,,2025-08-02T21:40:27.347Z,"{""url"":""https://x.com/CorbynSnap/status/1720717171666415682""}",,,,
1744666461312827758,agelender,Amanda Gelender🔮,"Zionism is not a “Jewish liberation movement”—there is nothing liberatory about mass murder, displacement &amp; land theft

The only face of Zionism that Palestinians have ever known is fascist death squads at the door: I’m more interested in Palestinian reality than Zionist fantasy.",2024-01-09T10:24:33.000Z,,https://x.com/agelender/status/1744666461312827758,"{""post_id"":null,""profile_id"":null,""profile_name"":null,""data_posted"":null,""url"":null,""description"":null,""photos"":null,""videos"":null}",,53,796,1975,55248,,,34490,🪐 Writer 🪂 Jewish anti-zionist ✨Abolition | Film/TV,16864,https://pbs.twimg.com/profile_images/1660587583133417475/yBb35BgL_normal.jpg,2344,FALSE,9,61,"{""post_id"":null,""profile_id"":""2858419898"",""profile_name"":""Amanda Gelender🔮""}",,,,,2858419898,,2025-08-02T21:40:27.363Z,"{""url"":""https://x.com/agelender/status/1744666461312827758""}",,,,
1905004456787456313,HaybeWarsam,Haybe Warsame,"@JQRADIO247 Paid by the ZOG with your taxes.

#FreePalestine  🇵🇸 and the 🇺🇸 from narcissist murderous occupiers.

#StopGazaGenocide‌NOW",2025-03-26T21:10:30.000Z,"[""https://pbs.twimg.com/media/Gm_uIrUXAAANSZL.jpg""]",https://x.com/HaybeWarsam/status/1905004456787456313,"{""post_id"":null,""profile_id"":null,""profile_name"":null,""data_posted"":null,""url"":null,""description"":null,""photos"":null,""videos"":null}","[{""profile_id"":""1867056671241158656"",""profile_name"":""JQR"",""url"":""https://x.com/JQRADIO247"",""biography"":null,""is_verified"":null,""following"":null,""followers"":null}]",0,1,7,216,,"[""FreePalestine"",""StopGazaGenocide‌NOW""]",1536,"“𝔾𝕣𝕖𝕒𝕥 𝕞𝕚𝕟𝕕𝕤 𝕕𝕚𝕤𝕔𝕦𝕤𝕤 𝕚𝕕𝕖𝕒𝕤, 𝕒𝕧𝕖𝕣𝕒𝕘𝕖 𝕞𝕚𝕟𝕕𝕤 𝕕𝕚𝕤𝕔𝕦𝕤𝕤 𝕖𝕧𝕖𝕟𝕥𝕤, 𝕤𝕞𝕒𝕝𝕝 𝕞𝕚𝕟𝕕𝕤 𝕕𝕚𝕤𝕔𝕦𝕤𝕤 𝕡𝕖𝕠𝕡𝕝𝕖.”",6408,https://pbs.twimg.com/profile_images/1722827658797391872/2TfKztAx_normal.jpg,881,FALSE,0,0,"{""post_id"":""1904722592293924907"",""profile_id"":""1867056671241158656"",""profile_name"":""JQRADIO247""}",,,,,1867056671241158656,,2025-08-02T21:40:27.367Z,"{""url"":""https://x.com/HaybeWarsam/status/1905004456787456313""}",,,,
